,award recipients:
335,"Rinni Bhansali, Half Hollow Hills High School East, NY, United States of America"
336,"Zong-Hong Cheng, The Affiliated Senior High School of National Taiwan Normal University, Taiwan"
337,"John Piwinski, BASIS San Antonio Shavano Campus, TX, United States of America"
338,"Seo Yeong Kwag, Blair Academy, NJ, United States of America"
339,"Taeyang Park, Peddie School, NJ, United States of America"
340,"Drake Ludgate, Brush High School, CO, United States of America"
341,"Nathaniel Miner, Brush High School, CO, United States of America"
342,"Daniel Santiago, Centro Residencial de Oportunidades Educativas de Mayagüez, Puerto Rico"
343,"Andrei Mandelshtam, University High School, CA, United States of America"
344,"Callum Predavec, Mosman High School, NSW, Australia"
345,"Leo Takemaru, Ward Melville High School, NY, United States of America"
346,"Poojan Pandya, Half Hollow Hills High School West, NY, United States of America"
347,"Leo Takemaru, Ward Melville High School, NY, United States of America"
348,"Poojan Pandya, Half Hollow Hills High School West, NY, United States of America"
349,"Miamar Burgos-Rosario, Hayfield Secondary School, VA, United States of America"
350,"Saijai Supanklang, Hayfield Secondary School, VA, United States of America"
351,"Sarah Syed, Hayfield Secondary School, VA, United States of America"
352,"Luke Long, Canterbury School, FL, United States of America"
353,"Maitane Alonso Monasterio , Avellaneda Ikastetxea, Spain"
354,"Emily Kang, Canyon Crest Academy, CA, United States of America"
355,"Daniel Feng, University High School, CA, United States of America"
356,"Logan Dunkenberger, Roanoke Valley Governor’s School for Science and Technology, VA, United States of America"
357,"Alexandria Montgomery, West Salem High School, OR, United States of America"
358,"Varsha Naga, Winter Springs High School, FL, United States of America"
359,"Sophie Kearney, Midway High School, TX, United States of America"
360,"Yee Lin Tan, National Junior College, Singapore"
361,"Divyam Goel, West High School, UT, United States of America"
362,"Sruthi Kalavacherla, Amador Valley High School, CA, United States of America"
363,"Anne Liang, duPont Manual High School, KY, United States of America"
364,"Anastasia Zdrobau, Theoretical High School, Republic of Moldova"
365,"Catarina-Severina Martin, Theoretical High School, Republic of Moldova"
366,"Blanka Novak, Istvan Dobo Secondary Grammar School, Heves, Hungary"
367,"Brent Perlman, Byram Hills High School, NY, United States of America"
368,"Neehal Tumma, Port Huron Northern High School, MI, United States of America"
369,"John Lin, Boston Latin School, MA, United States of America"
370,"Isabella Wiebelt-Smith, Central High School, MO, United States of America"
371,"Cheryl Luo, Yorktown High School, NY, United States of America"
372,"Aria Eppinger, Winchester Thurston School, PA, United States of America"
373,"Vanessa Siggers, Murphy High School, AL, United States of America"
374,"Kaylie Hausknecht, Lynbrook Senior High School, NY, United States of America"
375,"Dahlia Dry, Fort Myers High School, FL, United States of America"
376,"Kaylie Hausknecht, Lynbrook Senior High School, NY, United States of America"
377,"Brendon Matusch, Lo-Ellen Park Secondary School, Ontario, Canada"
378,"Kevin Qian, Montgomery Blair High School, MD, United States of America"
379,"Stephanie Yoshida, Punahou School, HI, United States of America"
380,"Vivek Vijayakumar, San Marcos High School, CA, United States of America"
381,"Noah Dormann, Chiemgau-Gymnasium Traunstein, Germany"
382,"Nikita Salunke, Evergreen Valley High School, CA, United States of America"
383,"Natan Dominko Kobilica, Gimnazija Bezigrad, Slovenia"
384,"Rebecka Mahring, Viktor Rydbergs Gymnasium Odenplan, Stockholm, Sweden"
385,"Lucas Braun, School of Science & Technology, OR, United States of America"
386,"Qingyi Wang, No. 2 High School of East China Normal University, Shanghai, China"
387,"Joshua Harmon, Camdenton High School, MO, United States of America"
388,"Parker Jou, Carmel High School, IN, United States of America"
389,"Rune Edeling, Eunice High School, Free State, South Africa"
390,"Ethan Rosenfeld, Phoenix Country Day School, AZ, United States of America"
391,"Joy Ma, Fairview High School, CO, United States of America"
392,"Dea Ilarionova, Cervantes Gymnasium AIA-GESS, Georgia"
393,"Marina Gudzhabidze, Cervantes Gymnasium AIA-GESS, Georgia"
394,"Shorena Gudzhabidze, Cervantes Gymnasium AIA-GESS, Georgia"
395,"Amara Ifeji, Bangor High School, ME, United States of America"
396,"Adham Kassem, College Park High School, TX, United States of America"
397,"Amara Ifeji, Bangor High School, ME, United States of America"
398,"Kathryn Kummel, William J. Palmer High School, CO, United States of America"
399,"Emma Kratcha, Hankinson Public School, ND, United States of America"
400,"Manya M. Kumar, Kendriya Vidyalaya No.1 Naval Base Kochi, Kerala, India"
401,"Richard Joseph, Kendriya Vidyalaya No.1 Naval Base Kochi, Kerala, India"
402,"Jihyun Ra, Kangwon Science High School, South Korea"
403,"Yoonji Kim, Kangwon Science High School, South Korea"
404,"Hongjia Yang, High School Affiliated to Shanghai Jiao Tong University, Shanghai, China"
405,"Shwe Win, Hilo High School, HI, United States of America"
406,"Haley Jostes, Stillwater Area High School, MN, United States of America"
407,"Damian Galasso, Galasso Homeschool, AZ, United States of America"
408,"Joao Pedro Silvestre Armani, Colegio Gabriela Mistral, Parana, Brazil"
409,"Sutthida Iamsaard, Phanomsarakham Phanom Adun Witthaya School, Thailand"
410,"Thirakarn Wannakarn, Phanomsarakham Phanom Adun Witthaya School, Thailand"
411,"Mary Jia, Arkansas School for Mathematics, Sciences and the Arts, AR, United States of America"
412,"Hannah Taylor, Agriscience Magnet Program, TX, United States of America"
413,"Haya Altuwaijry , Riyadh School for Boys and Girls, Saudi Arabia"
414,"Dheiksha Jayasankar, Sir Winston Churchill Secondary School, Ontario, Canada"
415,"Kamron Zaidi, Richmond Hill High School, Ontario, Canada"
416,"Sabrina Zaidi, Richmond Hill High School, Ontario, Canada"
417,"Laboni Santra, Oviedo High School, FL, United States of America"
418,"Natthamon Sriprom, Damrongratsongkroh School, Chiangrai, Thailand"
419,"Phan-Anong Chuenchokchai, Damrongratsongkroh School, Chiangrai, Thailand"
420,"Ramita Chueamuangphan, Damrongratsongkroh School, Chiangrai, Thailand"
421,"Pragati Muthukumar, Commack High School, NY, United States of America"
422,"Kevin Meng, Plano West Senior High School, TX, United States of America"
423,"Pranav Senthilvel, duPont Manual High School, KY, United States of America"
424,"Shreshth Srivastava, duPont Manual High School, KY, United States of America"
425,"Kevin Meng, Plano West Senior High School, TX, United States of America"
426,"Bradley Xu, Shanghai American School – Pudong Campus, Shanghai, China"
427,"Milidu Jayaweera, La Cueva High School, NM, United States of America"
428,"Raghav Ganesh, Lynbrook High School, CA, United States of America"
429,"Joseph Saturnino, Bishop Ryan Catholic Secondary School, Ontario, Canada"
430,"Siddarth Ijju, Cherry Creek High School, CO, United States of America"
431,"Laura Thompson, Mountain Vista Governor’s School, VA, United States of America"
432,"Anish Singhani, Monte Vista High School, CA, United States of America"
433,"Ashish Rao, Cupertino High School, CA, United States of America"
434,"Bidipta Sarkar, Cupertino High School, CA, United States of America"
435,"Tejas Narayanan, Cupertino High School, CA, United States of America"
436,"Sauhaarda Chowdhuri, Westview High School, CA, United States of America"
437,"Long Vu , Lao Cai High School No. 1, Viet Nam"
438,"MaryAlice Young, Bishop Kenny High School, FL, United States of America"
439,"Musa Sadik Unal, Kartal Anadolu Imam Hatip High School, Turkey"
440,"Zachary Hohl, Edgewood Junior Senior High School, FL, United States of America"
441,"Haohui Liu, Raffles Girls School (Secondary), Singapore, Singapore"
442,"Nikhil Devanathan, Kennewick High School, WA, United States of America"
443,"Nazar Ponochevnyi, Specialized School #52 in Kyiv With In-depth Study of Information Technology, Kyivs’ka Oblast, Ukraine"
444,"Jerry Wei, Oakton High School, VA, United States of America"
445,"Aditya Radhakrishnan, Suguna PIP School, Tamil Nadu, India"
446,"Adam Kelly, Skerries Community College, Ireland"
447,"Gabrielle Liu, Ravenwood High School, TN, United States of America"
448,"Adam Kelly, Skerries Community College, Ireland"
449,"Yufeng Sun, The Experimental High School Attached to Beijing Normal University, Beijing, China"
450,"Daniil Kazantsev, Municipal Lyceum #12, Russian Federation"
451,"Brandon Fan, Blacksburg High School, VA, United States of America"
452,"Ian Langleben, Dawson College, Quebec, Canada"
453,"Liana Martins-Medina, Marianopolis College, Quebec, Canada"
454,"Robin Christ, Lessing Gymnasium Lampertheim, Hessen, Germany"
455,"Humza Salim, T.C. Jasper High School, TX, United States of America"
456,"Yousuf Ahmad, Jasper High School, TX, United States of America"
457,"Jessica Yu, West Linn High School, OR, United States of America"
458,"David Vulakh, Paul Laurence Dunbar High School, KY, United States of America"
459,"Dylan Wichman, Billings Central Catholic High School, MT, United States of America"
460,"Saraswati Sridhar, Southwestern Educational Society, Puerto Rico"
461,"Divya Amirtharaj, Westview High School, OR, United States of America"
462,"Jhorch Quispe Laura, Luis Alberto Sanchez, Apurimac, Peru"
463,"Karen Huaman Quintana, Luis Alberto Sanchez, Apurimac, Peru"
464,"Arda Mavi, Ayranci Anadolu Lisesi, Cankaya, Turkey"
465,"Zeynep Dikle, Nazmi Arikan Fen Bilimleri High School, Cankaya, Turkey"
466,"Chanikarn Prompat, Princess Chulabhorn Science High School Phetchaburi, Phetchaburi, Thailand"
467,"Neeranuch Sudcharoen, Princess Chulabhorn Science High School Phetchaburi, Phetchaburi, Thailand"
468,"Pornchanun Mangmeethanapiboon, Princess Chulabhorn Science High School Phetchaburi, Phetchaburi, Thailand"
469,"Khadija Elmagarmid, Qatar Academy Senior School, Al-Rayyan, Qatar"
470,"Sama Ayoub, Qatar Academy Doha, Qatar"
471,"Neil Deshmukh, Moravian Academy, PA, United States of America"
472,"Hannah Herbst, Florida Atlantic University High School, FL, United States of America"
473,"Hannah Herbst, Florida Atlantic University High School, FL, United States of America"
474,"Ananya Ganesh, The Westminster Schools, GA, United States of America"
475,"Macinley Butson, The Illawarra Grammar School, NSW, Australia"
476,"Kabir Jolly, College Park High School, TX, United States of America"
477,"Renner Kwittken, Byram Hills High School, NY, United States of America"
478,"Ishana Shastri, Poolesville High School, MD, United States of America"
479,"Allie Amerman, Wheaton High School, MD, United States of America"
480,"Viswesh Krishna, National Public School, Indiranagar, Karnataka, India"
481,"Vrishab Krishna, National Public School, Indiranagar, Karnataka, India"
482,"Ishaan Maitra, North Carolina School of Science and Mathematics, NC, United States of America"
483,"Ekarinny Medeiros, Escola Estadual Professor Hermogenes Nogueira da Costa, Rio Grande do Norte, Brazil"
484,"Sathvik Nallamalli, Olympia High School, WA, United States of America"
485,"Adarsha Pokkulandra, Dulles High School, TX, United States of America"
486,"Arnav Garyali, Dulles High School, TX, United States of America"
487,"Olha Kharasakhal, Mariupol Technical Lyceum, Ukraine"
488,"Elizabeth Ding, Lexington High School, MA, United States of America"
